{
  "$schema"                : "https://raw.githubusercontent.com/microsoft/AI/master/.ci/listing_config_schema.json",
  "offer_setup"            : {
    "alias"    : "industrail-ai-ama",
    "testDrive": false,
    "crm"      : ""
  },
  "property_settings"      : {
    "category"   : "analytics",
    "categories": [
      {
        "category"   : "analytics",
        "subcategory": [
          "Big Data",
          "Data Analytics"
        ]
      }
    ]
  },
  "offer_listing"          : {
    "title"              : "MMLSpark on Databricks",
    "publisher_name"     : "Microsoft Corporation",
    "name"               : "MMLSpark on Databricks",
    "summary"            : "<Search results Summary*>",
    "short_description"  : "<Short description*>",
    "description"        : "<Description>",
    "keywords"           : [
      "design",
      "simulation",
      "engineer"
    ],
    "listing_contacts"   : [
      {
        "type" : "CustomerSupport",
        "email": "name@email.com",
        "name" : "FirstName LastName",
        "phone": "+5555555555",
        "uri"  : "https://website.design/moreinfo/contactus"
      },
      {
        "type" : "Engineering",
        "email": "name@company.com",
        "name" : "Name Name",
        "phone": "+5555555555"
      }
    ],
    "listing_uris"       : [
      {
        "type"       : "PrivacyUri",
        "displayText": "Privacy Url",
        "uri"        : "https://website.design/eula"
      },
      {
        "type"       : "PublicCloudSupport",
        "displayText": "Privacy PublicCloudSupport",
        "uri"        : "https://website.design/PublicCloudSupport"
      }
    ],
    "listing_logos"      : {
      "logo_large" : "r_216_216.png",
      "logo_small" : "r_48_48.png",
      "logo_medium": "r_90_90.png",
      "logo_wide"  : "r_255_115.png"
    },
    "listing_screenshots": {},
    "listing_videos"     : {}
  },
  "preview_audience"       : {
    "subscriptions": [
      "422895b2-0fda-4709-9ab8-7df1295fedd7"
    ]
  },
  "technical_configuration": {
    "_note"         : "Only required for emitting metering events",
    "tenant_id"     : "<AAD Tenant Id>",
    "application_id": "<AAD Application ID>"
  },
  "plan_overview"          : [
    {
      "plan_listing"            : {
        "title"      : "website.Design",
        "summary"    : "Summary for Test",
        "description": "Description for Test"
      },
      "pricing_and_availability": {
        "visibility"                 : "private",
        "azure_private_subscriptions": [
          {
            "ID": "422895b2-0fda-4709-9ab8-7df1295fedd7"
          }
        ]
      },
      "technical_configuration" : {
        "version"               : "0.0.0",
        "allowedCustomerActions": [
          "Microsoft.Storage/*;Microsoft.MachineLearningServices/*;Microsoft.DocumentDB/*;Microsoft.Kubernetes/*;Microsoft.Insights/*;Microsoft.KeyVault/*;Microsoft.Databricks/*;Microsoft.ManagedIdentity/*;Microsoft.ContainerService/*;Microsoft.MachineLearning/*;Microsoft.Synapse/*;Microsoft.Network/*"
        ],
        "allowedDataActions"    : [
          "Microsoft.Storage/*;Microsoft.MachineLearningServices/*;Microsoft.DocumentDB/*;Microsoft.Kubernetes/*;Microsoft.Insights/*;Microsoft.KeyVault/*;Microsoft.Databricks/*;Microsoft.ManagedIdentity/*;Microsoft.ContainerService/*;Microsoft.MachineLearning/*;Microsoft.Synapse/*;Microsoft.Network/*"
        ],
        "tenant_id"             : "<AAD Tenant Id>",
        "authorizations"        : [
          {
            "id"  : "<AAD Owner Application ID>",
            "role": "Owner"
          },
          {
            "id"  : "<AAD Contributor Application ID>",
            "role": "Contributor"
          }
        ],
        "policy_settings"       : []
      }
    }
  ],
  "co-sell"                : {},
  "resell"                 : {}
}
